{
  "schemaVersion": "1.0.0",
  "planId": "ownership.synthetic.aws.orders.v1",
  "planningAt": "2026-08-16T21:00:00Z",
  "maxEvidenceAgeHours": 48,
  "evidenceMode": "synthetic",
  "sourceProvider": "aws",
  "target": {
    "environment": "prod",
    "environmentReference": "environment.production.orders",
    "region": "centralus",
    "targetReference": "target.postgresql.orders.flexible"
  },
  "integration": {
    "predecessorProgramLineageEnvelopeDigest": "sha256:1111111111111111111111111111111111111111111111111111111111111111",
    "programIdentityDigest": "sha256:2222222222222222222222222222222222222222222222222222222222222222",
    "connectivityPlanDigest": "sha256:3333333333333333333333333333333333333333333333333333333333333333",
    "postgresqlMigrationPlanDigest": "sha256:4444444444444444444444444444444444444444444444444444444444444444",
    "containerImageCicdPlanDigest": "sha256:5555555555555555555555555555555555555555555555555555555555555555",
    "readinessEvidenceDigest": "sha256:6666666666666666666666666666666666666666666666666666666666666666",
    "iacPlanDigest": "sha256:7777777777777777777777777777777777777777777777777777777777777777",
    "deploymentManifestDigest": "sha256:8888888888888888888888888888888888888888888888888888888888888888",
    "deploymentApprovalDigest": "sha256:9999999999999999999999999999999999999999999999999999999999999999",
    "environment": "prod",
    "environmentReference": "environment.production.orders",
    "targetReference": "target.postgresql.orders.flexible"
  },
  "roles": [
    {
      "reference": "role.source-cloud-platform",
      "type": "source-cloud"
    },
    {
      "reference": "role.azure-platform",
      "type": "azure"
    },
    {
      "reference": "role.shared-platform",
      "type": "shared-platform"
    },
    {
      "reference": "role.application",
      "type": "application"
    },
    {
      "reference": "role.security",
      "type": "security"
    },
    {
      "reference": "role.network",
      "type": "network"
    },
    {
      "reference": "role.database",
      "type": "database"
    },
    {
      "reference": "role.incident",
      "type": "incident"
    }
  ],
  "capabilities": [
    "dns-zones-records-resolvers",
    "certificate-issuance-renewal",
    "secret-stores-references-rotation",
    "cicd-pipelines-runners",
    "artifact-promotion",
    "observability-telemetry-alert-routing",
    "incidents-oncall-escalation",
    "feature-flags-configuration",
    "deployment-authority",
    "database-writes",
    "application-writes",
    "source-of-truth-transfer",
    "backup-restore",
    "cutover",
    "rollback",
    "failback"
  ],
  "states": [
    {
      "state": "coexistence",
      "ordinal": 1,
      "assignments": [
        {
          "capabilityId": "dns-zones-records-resolvers",
          "accountable": "role.network",
          "responsible": [
            "role.network"
          ],
          "consulted": [
            "role.security"
          ],
          "informed": [
            "role.incident"
          ],
          "approvalAuthority": null,
          "authorityScope": "source-cloud"
        },
        {
          "capabilityId": "certificate-issuance-renewal",
          "accountable": "role.security",
          "responsible": [
            "role.security"
          ],
          "consulted": [
            "role.shared-platform"
          ],
          "informed": [
            "role.incident"
          ],
          "approvalAuthority": "role.incident",
          "authorityScope": "source-cloud"
        },
        {
          "capabilityId": "secret-stores-references-rotation",
          "accountable": "role.security",
          "responsible": [
            "role.security"
          ],
          "consulted": [
            "role.shared-platform"
          ],
          "informed": [
            "role.incident"
          ],
          "approvalAuthority": "role.incident",
          "authorityScope": "source-cloud"
        },
        {
          "capabilityId": "cicd-pipelines-runners",
          "accountable": "role.shared-platform",
          "responsible": [
            "role.shared-platform"
          ],
          "consulted": [
            "role.security"
          ],
          "informed": [
            "role.incident"
          ],
          "approvalAuthority": null,
          "authorityScope": "shared"
        },
        {
          "capabilityId": "artifact-promotion",
          "accountable": "role.shared-platform",
          "responsible": [
            "role.shared-platform"
          ],
          "consulted": [
            "role.security"
          ],
          "informed": [
            "role.incident"
          ],
          "approvalAuthority": "role.security",
          "authorityScope": "source-cloud"
        },
        {
          "capabilityId": "observability-telemetry-alert-routing",
          "accountable": "role.shared-platform",
          "responsible": [
            "role.shared-platform"
          ],
          "consulted": [
            "role.security"
          ],
          "informed": [
            "role.incident"
          ],
          "approvalAuthority": null,
          "authorityScope": "shared"
        },
        {
          "capabilityId": "incidents-oncall-escalation",
          "accountable": "role.incident",
          "responsible": [
            "role.incident"
          ],
          "consulted": [
            "role.security"
          ],
          "informed": [
            "role.application"
          ],
          "approvalAuthority": null,
          "authorityScope": "shared"
        },
        {
          "capabilityId": "feature-flags-configuration",
          "accountable": "role.application",
          "responsible": [
            "role.application"
          ],
          "consulted": [
            "role.security"
          ],
          "informed": [
            "role.incident"
          ],
          "approvalAuthority": null,
          "authorityScope": "shared"
        },
        {
          "capabilityId": "deployment-authority",
          "accountable": "role.shared-platform",
          "responsible": [
            "role.shared-platform"
          ],
          "consulted": [
            "role.security"
          ],
          "informed": [
            "role.incident"
          ],
          "approvalAuthority": "role.security",
          "authorityScope": "source-cloud"
        },
        {
          "capabilityId": "database-writes",
          "accountable": "role.database",
          "responsible": [
            "role.database"
          ],
          "consulted": [
            "role.security"
          ],
          "informed": [
            "role.incident"
          ],
          "approvalAuthority": "role.security",
          "authorityScope": "source-cloud"
        },
        {
          "capabilityId": "application-writes",
          "accountable": "role.application",
          "responsible": [
            "role.application"
          ],
          "consulted": [
            "role.security"
          ],
          "informed": [
            "role.incident"
          ],
          "approvalAuthority": "role.security",
          "authorityScope": "source-cloud"
        },
        {
          "capabilityId": "source-of-truth-transfer",
          "accountable": "role.database",
          "responsible": [
            "role.database"
          ],
          "consulted": [
            "role.security"
          ],
          "informed": [
            "role.incident"
          ],
          "approvalAuthority": "role.security",
          "authorityScope": "source-cloud"
        },
        {
          "capabilityId": "backup-restore",
          "accountable": "role.database",
          "responsible": [
            "role.database"
          ],
          "consulted": [
            "role.security"
          ],
          "informed": [
            "role.incident"
          ],
          "approvalAuthority": null,
          "authorityScope": "source-cloud"
        },
        {
          "capabilityId": "cutover",
          "accountable": "role.incident",
          "responsible": [
            "role.incident"
          ],
          "consulted": [
            "role.security"
          ],
          "informed": [
            "role.application"
          ],
          "approvalAuthority": "role.security",
          "authorityScope": "source-cloud"
        },
        {
          "capabilityId": "rollback",
          "accountable": "role.incident",
          "responsible": [
            "role.incident"
          ],
          "consulted": [
            "role.security"
          ],
          "informed": [
            "role.application"
          ],
          "approvalAuthority": "role.security",
          "authorityScope": "source-cloud"
        },
        {
          "capabilityId": "failback",
          "accountable": "role.incident",
          "responsible": [
            "role.incident"
          ],
          "consulted": [
            "role.security"
          ],
          "informed": [
            "role.application"
          ],
          "approvalAuthority": "role.security",
          "authorityScope": "source-cloud"
        }
      ]
    },
    {
      "state": "pre-cutover",
      "ordinal": 2,
      "assignments": [
        {
          "capabilityId": "dns-zones-records-resolvers",
          "accountable": "role.network",
          "responsible": [
            "role.network"
          ],
          "consulted": [
            "role.security"
          ],
          "informed": [
            "role.incident"
          ],
          "approvalAuthority": null,
          "authorityScope": "source-cloud"
        },
        {
          "capabilityId": "certificate-issuance-renewal",
          "accountable": "role.security",
          "responsible": [
            "role.security"
          ],
          "consulted": [
            "role.shared-platform"
          ],
          "informed": [